{
  "sessionId": "a0eebc99-9c0b-4ef8-bb6d-6bb9bd380a11",
  "projectId": "b0eebc99-9c0b-4ef8-bb6d-6bb9bd380a22",
  "userId": "c0eebc99-9c0b-4ef8-bb6d-6bb9bd380a33",
  "currentStep": 2,
  "status": "ACTIVE",
  "contextData": {
    "subjectGroup": "MATH",
    "educationLevel": "SECONDARY",
    "targetGrade": "Lớp 8",
    "topicTitle": "Vận dụng mô hình hóa toán học giải quyết bài toán thực tiễn",
    "collectedFacts": {
      "initialPassRate": "62%",
      "targetPassRate": "88%"
    }
  },
  "updatedAt": "2026-09-02T10:00:00.000Z"
}
